{
  "id": "https://geolabs.github.io/bblocks-process-profiles/def/process-type/algae-bloom/calculate-band",
  "type": "ProcessType",
  "prefLabel": "Performs a calculation with bands.",
  "definition": "Performs a calculation over JPEG bands and returns the resulting GeoTiff.",
  "inScheme": "https://geolabs.github.io/bblocks-process-profiles/def/process-type",
  "status": "submitted",
  "phase": [
    "https://geolabs.github.io/bblocks-process-profiles/def/phase/scientific-computation"
  ],
  "profile": "ospd.process-profiles.algae-bloom.calculate-band",
  "processDescription": {
    "id": "calculate-band",
    "version": "1.1.0"
  },
  "source": {
    "cwl": "https://github.com/crim-ca/ogc-ospd-phase1/blob/5edd4ec4cbd21e5fceb7c3f4b6c5d0ce809a57ea/ogc_app_pkg/calculate-band.cwl",
    "cwlClass": "CommandLineTool",
    "cwlId": "calculate-band",
    "license": "https://spdx.org/licenses/CC-BY-NC-SA-4.0"
  },
  "provenanceClass": "http://purl.org/wf4ever/wfprov#ProcessRun",
  "cctDependencies": [],
  "candidateCctDependencies": [],
  "closeMatch": [
    "https://www.opengis.net/def/bblocks/ogc.openeo.processes.cubes.reduce_dimension"
  ],
  "relatedMatch": [
    "https://www.opengis.net/def/bblocks/ogc.openeo.processes.math.divide",
    "https://www.opengis.net/def/bblocks/ogc.openeo.processes.math.power",
    "https://www.opengis.net/def/bblocks/ogc.openeo.processes.math.multiply",
    "https://www.opengis.net/def/bblocks/ogc.openeo.processes.math.subtract"
  ],
  "openeoEquivalence": {
    "level": "closeMatch",
    "rationale": "Generic band math (gdal_calc.py with a Python/numpy expression over up to 26 bands A..Z): openEO expresses it as reduce_dimension over the `bands` dimension with a callback built from math processes. closeMatch at the generic level; each W1 instance is a fixed chain of math processes (see decomposition). The expression is free text in CWL, a process graph in openEO.",
    "decomposition": [
      {
        "stage": "chlorophyll_a = 4.26*((C/A)**3.94), A=B01 60m, C=B03 60m",
        "openeo": [
          "ogc.openeo.processes.math.divide",
          "ogc.openeo.processes.math.power",
          "ogc.openeo.processes.math.multiply"
        ],
        "level": "closeMatch"
      },
      {
        "stage": "cyanobacteria = 115530*(((B*C)/A)**2.38), A=B02, B=B03, C=B04 (10m)",
        "openeo": [
          "ogc.openeo.processes.math.multiply",
          "ogc.openeo.processes.math.divide",
          "ogc.openeo.processes.math.power"
        ],
        "level": "closeMatch",
        "note": "coefficient is 115530 in the Earth-Search variant, 115530.31 in the Copernicus variant"
      },
      {
        "stage": "turbidity = (8.93*(C/A))-6.39, A=B01 60m, C=B03 60m",
        "openeo": [
          "ogc.openeo.processes.math.divide",
          "ogc.openeo.processes.math.multiply",
          "ogc.openeo.processes.math.subtract"
        ],
        "level": "closeMatch"
      }
    ]
  }
}
