{
  "id": "https://geolabs.github.io/bblocks-process-profiles/def/process-type/kindgrove/parse-aoi",
  "type": "ProcessType",
  "prefLabel": "Parse area of interest",
  "definition": "Unpacks an OGC bounding box (EOAP BBox custom type) into west, south, east and north coordinates.",
  "inScheme": "https://geolabs.github.io/bblocks-process-profiles/def/process-type",
  "status": "submitted",
  "phase": [
    "https://geolabs.github.io/bblocks-process-profiles/def/phase/filter-configuration"
  ],
  "profile": "ospd.process-profiles.kindgrove.parse-aoi",
  "processDescription": {
    "id": "parse_aoi",
    "version": "0.0.1"
  },
  "source": {
    "cwl": "https://github.com/GeoLabs/bblocks-eoap-cct/blob/c27c60d2755c01f69bd7f1bd0903b6388d375e58/_sources/cwl-to-ogcprocess/examples/mangrove-workflow.cwl#parse_aoi",
    "cwlClass": "CommandLineTool",
    "cwlId": "parse_aoi",
    "license": "https://spdx.org/licenses/Apache-2.0"
  },
  "provenanceClass": "http://purl.org/wf4ever/wfprov#ProcessRun",
  "cctDependencies": [
    "eoap.cct.bbox"
  ],
  "candidateCctDependencies": [],
  "relatedMatch": [
    "https://www.opengis.net/def/bblocks/ogc.openeo.types.bounding-box"
  ],
  "openeoEquivalence": {
    "level": "none",
    "rationale": "Structural helper: unpacks an OGC BBox record into west/south/east/north floats and emits a constant `output_dir` (\"outputs\"). No openEO process does this, because openEO passes a bounding box object directly (`ogc.openeo.types.bounding-box`, relatedMatch at type level)."
  }
}
