{
  "id": "https://geolabs.github.io/bblocks-process-profiles/def/process-type/kindgrove-steps/mangrove-workflow-steps",
  "type": "ProcessType",
  "prefLabel": "Mangrove Biomass Workflow (step notebooks)",
  "definition": "Mangrove above-ground biomass and carbon stock estimation from Sentinel-2 L2A, split into one CommandLineTool per processing step, aligned on the steps of the OSPD W1 Algae Bloom workflow: parse_aoi -> select_scene -> download_band (x3) -> reproject_band (x3) -> calculate_indices -> estimate_biomass -> export_stac.",
  "inScheme": "https://geolabs.github.io/bblocks-process-profiles/def/process-type",
  "status": "submitted",
  "phase": [
    "https://geolabs.github.io/bblocks-process-profiles/def/phase/filter-configuration",
    "https://geolabs.github.io/bblocks-process-profiles/def/phase/selection-filtering",
    "https://geolabs.github.io/bblocks-process-profiles/def/phase/data-retrieval",
    "https://geolabs.github.io/bblocks-process-profiles/def/phase/pre-processing",
    "https://geolabs.github.io/bblocks-process-profiles/def/phase/scientific-computation",
    "https://geolabs.github.io/bblocks-process-profiles/def/phase/export-aggregation"
  ],
  "profile": "ospd.process-profiles.kindgrove-steps.mangrove-workflow-steps",
  "processDescription": {
    "id": "mangrove-workflow-steps",
    "version": "0.1.0"
  },
  "source": {
    "cwl": "https://github.com/GeoLabs/KindGrove/releases/download/v0.0.2-rc2/mangrove-workflow-steps.cwl#mangrove-workflow-steps",
    "cwlClass": "Workflow",
    "cwlId": "mangrove-workflow-steps",
    "license": "https://spdx.org/licenses/CC-BY-NC-SA-4.0"
  },
  "provenanceClass": "http://purl.org/wf4ever/wfprov#WorkflowRun",
  "cctDependencies": [
    "eoap.cct.bbox"
  ],
  "candidateCctDependencies": [],
  "hasStep": [
    "https://geolabs.github.io/bblocks-process-profiles/def/process-type/kindgrove-steps/parse-aoi-steps",
    "https://geolabs.github.io/bblocks-process-profiles/def/process-type/kindgrove-steps/select-scene",
    "https://geolabs.github.io/bblocks-process-profiles/def/process-type/kindgrove-steps/download-band",
    "https://geolabs.github.io/bblocks-process-profiles/def/process-type/kindgrove-steps/reproject-band",
    "https://geolabs.github.io/bblocks-process-profiles/def/process-type/kindgrove-steps/calculate-indices",
    "https://geolabs.github.io/bblocks-process-profiles/def/process-type/kindgrove-steps/estimate-biomass",
    "https://geolabs.github.io/bblocks-process-profiles/def/process-type/kindgrove-steps/export-stac"
  ],
  "openeoEquivalence": {
    "level": "none",
    "rationale": "Composite: a CWL Workflow decomposed into one CommandLineTool per notebook, aligned on the same granularity as W1 Algae Bloom (parse AOI, select scene, download/reproject bands, compute indices, estimate biomass, export STAC) -- the workflow's own `doc:` says so explicitly. A ground-up reimplementation of `kindgrove.mangrove-workflow`'s computation, not a repackaging of it; the openEO equivalent would be a user-defined process graph.",
    "decomposition": [
      {
        "stage": "select_scene",
        "openeo": [
          "ogc.openeo.processes.cubes.load_collection"
        ],
        "level": "closeMatch"
      },
      {
        "stage": "download_band (x3, scatter over bands)",
        "openeo": [
          "ogc.openeo.processes.cubes.load_collection",
          "ogc.openeo.processes.cubes.filter_bands"
        ],
        "level": "closeMatch"
      },
      {
        "stage": "reproject_band (x3)",
        "openeo": [
          "ogc.openeo.processes.cubes.resample_spatial"
        ],
        "level": "closeMatch"
      },
      {
        "stage": "calculate_indices",
        "openeo": [
          "ogc.openeo.processes.cubes.ndvi",
          "ogc.openeo.processes.math.indices.normalized_difference"
        ],
        "level": "closeMatch",
        "note": "NDVI and NDWI; SAVI has no openEO process in this register"
      },
      {
        "stage": "estimate_biomass",
        "openeo": [],
        "level": "none",
        "note": "opaque allometric regression + IPCC carbon fraction"
      },
      {
        "stage": "export_stac",
        "openeo": [
          "ogc.openeo.processes.cubes.save_result"
        ],
        "level": "closeMatch"
      }
    ]
  }
}